Код;Детальний опис
10000;Державне управління
10105;Апарат Верховної Ради Автономної Республіки Крим
10106;Забезпечення діяльності депутатів Автономної Республіки Крим
10108;Апарат Рахункової палати Верховної Ради Автономної Республіки Крим
10114;Апарат Ради міністрів Автономної Республіки Крим та її місцевих органів
10116;Органи місцевого самоврядування
10117;Органи виконавчої влади в м. Києві
60000;Правоохоронна діяльність та забезпечення безпеки держави
60103;Підрозділи дорожньо-патрульної служби та дорожнього нагляду
60106;Приймальники-розподільники для неповнолітніх
60107;Спеціальні приймальники-розподільники
60702;Місцева пожежна охорона
61002;Спеціальні монтажно-експлуатаційні підрозділи
61003;Адресно-довідкові бюро
61007;Інші правоохоронні заходи і заклади
70000;Освіта
70101;Дошкільні заклади освіти
70201;Загальноосвітні школи (в т. ч. школа-дитячий садок, інтернат при школі), спеціалізовані школи, ліцеї, гімназії, колегіуми
70202;Вечірні (змінні) школи
70301;Загальноосвітні школи-інтернати, загальноосвітні санаторні школи-інтернати
70302;Загальноосвітні школи-інтернати для дітей-сиріт та дітей, які залишилися без піклування батьків
70303;Дитячі будинки (в т. ч. сімейного типу, прийомні сім'ї)
70304;Спеціальні загальноосвітні школи-інтернати, школи та інші заклади освіти для дітей з вадами у фізичному чи розумовому розвитку
70307;Загальноосвітні спеціалізовані школи-інтернати з поглибленим вивченням окремих предметів і курсів для поглибленої підготовки дітей в галузі науки і мистецтв, фізичної культури і спорту, інших галузях, ліцеї з посиленою військово-фізичною підготовкою
70401;Позашкільні заклади освіти, заходи із позашкільної роботи з дітьми
70501;Професійно-технічні заклади освіти
70502;Професійно-технічні училища соціальної реабілітації
70601;Вищі заклади освіти I та II рівнів акредитації
70602;Вищі заклади освіти III та IV рівнів акредитації
70701;Заклади післядипломної освіти III - IV рівнів акредитації (академії, інститути, центри підвищення кваліфікації, перепідготовки, вдосконалення)
70702;Інші заклади і заходи післядипломної освіти
70801;Придбання підручників
70802;Методична робота, інші заходи у сфері народної освіти
70803;Служби технічного нагляду за будівництвом і капітальним ремонтом
70804;Централізовані бухгалтерії обласних, міських, районних відділів освіти
70805;Групи централізованого господарського обслуговування
70806;Інші заклади освіти
70807;Інші освітні програми
70808;Допомога дітям-сиротам та дітям, позбавленим батьківського піклування, яким виповнюється 18 років
70809;"Здійснення виплат, визначених Законом України ""Про реструктуризацію заборгованості з виплат, передбачених статтею 57 Закону України ""Про освіту"" педагогічним, науково-педагогічним та іншим категоріям працівників навчальних закладів"""
80000;Охорона здоров'я
80101;Лікарні
80102;Територіальні медичні об'єднання
80201;Спеціалізовані лікарні та інші спеціалізовані заклади (центри, диспансери, госпіталі для інвалідів ВВВ, лепрозорії, медико-санітарні частини тощо, що мають ліжкову мережу)
80202;Клініки науково-дослідних інститутів
80203;Пологові будинки
80204;Санаторії для хворих туберкульозом
80205;Санаторії для дітей та підлітків (нетуберкульозні)
80206;Санаторії медичної реабілітації
80207;Будинки дитини
80208;Станції переливання крові
80209;Станції швидкої та невідкладної медичної допомоги
80300;Поліклініки і амбулаторії (крім спеціалізованих поліклінік та загальних і спеціалізованих стоматологічних поліклінік)
80400;Спеціалізовані поліклініки (в т. ч. диспансери, медико-санітарні частини, пересувні консультативні діагностичні центри тощо, які не мають ліжкового фонду)
80500;Загальні і спеціалізовані стоматологічні поліклініки
80600;Фельдшерсько-акушерські пункти
80703;Заходи боротьби з епідеміями
80704;Центри здоров'я і заходи у сфері санітарної освіти
81001;Медико-соціальні експертні комісії
81002;Інші заходи по охороні здоров'я
81003;Служби технічного нагляду за будівництвом та капітальним ремонтом
81004;Централізовані бухгалтерії
81005;Групи централізованого господарського обслуговування
81006;Програми і централізовані заходи з імунопрофілактики
81007;Програми і централізовані заходи боротьби з туберкульозом
81008;Програми і централізовані заходи профілактики СНІДу
81009;Забезпечення централізованих заходів з лікування хворих на цукровий та нецукровий діабет
81010;Централізовані заходи з лікування онкологічних хворих
90000;Соціальний захист та соціальне забезпечення
90201;"Пільги ветеранам війни, особам, на яких поширюється чинність Закону України ""Про статус ветеранів війни, гарантії їх соціального захисту"", особам, які мають особливі заслуги перед Батьківщиною, вдовам (вдівцям) та батькам померлих (загиблих) осіб, які мають особливі заслуги перед Батьківщиною, дітям війни, особам, які мають особливі трудові заслуги перед Батьківщиною, вдовам (вдівцям) та батькам померлих (загиблих) осіб, які мають особливі трудові заслуги перед Батьківщиною, жертвам нацистських переслідувань та реабілітованим громадянам, які стали інвалідами внаслідок репресій або є пенсіонерами, на житлово-комунальні послуги"
90202;"Пільги ветеранам війни, особам, на яких поширюється чинність Закону України ""Про статус ветеранів війни, гарантії їх соціального захисту"", особам, які мають особливі заслуги перед Батьківщиною, вдовам (вдівцям) та батькам померлих (загиблих) осіб, які мають особливі заслуги перед Батьківщиною, особам, які мають особливі трудові заслуги перед Батьківщиною, вдовам (вдівцям) та батькам померлих (загиблих) осіб, які мають особливі трудові заслуги перед Батьківщиною, жертвам нацистських переслідувань на придбання твердого палива та скрапленого газу"
90203;"Інші пільги ветеранам війни, особам, на яких поширюється чинність Закону України ""Про статус ветеранів війни, гарантії їх соціального захисту"", особам, які мають особливі заслуги перед Батьківщиною, вдовам (вдівцям) та батькам померлих (загиблих) осіб, які мають особливі заслуги перед Батьківщиною, ветеранам праці, особам, які мають особливі трудові заслуги перед Батьківщиною, вдовам (вдівцям) та батькам померлих (загиблих) осіб, які мають особливі трудові заслуги перед Батьківщиною, жертвам нацистських переслідувань та реабілітованим громадянам, які стали інвалідами внаслідок репресій або є пенсіонерами"
90204;Пільги ветеранам військової служби, ветеранам органів внутрішніх справ, ветеранам податкової міліції, ветеранам державної пожежної охорони, ветеранам Державної кримінально-виконавчої служби, ветеранам служби цивільного захисту, ветеранам Державної служби спеціального зв'язку та захисту інформації України, вдовам (вдівцям) померлих (загиблих) ветеранів військової служби, ветеранів органів внутрішніх справ, ветеранів податкової міліції, ветеранів державної пожежної охорони, ветеранів Державної кримінально-виконавчої служби, ветеранів служби цивільного захисту та ветеранів Державної служби спеціального зв'язку та захисту інформації України, звільненим зі служби за віком, хворобою або вислугою років військовослужбовцям Служби безпеки України, працівникам міліції, особам начальницького складу податкової міліції, рядового і начальницького складу кримінально-виконавчої системи, державної пожежної охорони, пенсіонерам з числа слідчих прокуратури, дітям (до досягнення повноліття) працівників міліції, осіб начальницького складу податкової міліції, рядового і начальницького складу кримінально-виконавчої системи, державної пожежної охорони, загиблих або померлих у зв'язку з виконанням службових обов'язків, непрацездатним членам сімей, які перебували на їх утриманні, звільненим з військової служби особам, які стали інвалідами під час проходження військової служби, батькам та членам сімей військовослужбовців, які загинули (померли) або пропали безвісти під час проходження військової служби, батькам та членам сімей осіб рядового і начальницького складу органів і підрозділів цивільного захисту, Державної служби спеціального зв'язку та захисту інформації України, які загинули (померли), пропали безвісті або стали інвалідами при проходженні служби, суддям у відставці, на житлово-комунальні послуги
90205;Пільги ветеранам військової служби, ветеранам органів внутрішніх справ, ветеранам податкової міліції, ветеранам державної пожежної охорони, ветеранам Державної кримінально-виконавчої служби, ветеранам служби цивільного захисту, ветеранам Державної служби спеціального зв'язку та захисту інформації України, вдовам (вдівцям) померлих (загиблих) ветеранів військової служби, ветеранів органів внутрішніх справ, ветеранів податкової міліції, ветеранів державної пожежної охорони, ветеранів Державної кримінально-виконавчої служби, ветеранів служби цивільного захисту та ветеранів Державної служби спеціального зв'язку та захисту інформації України, звільненим зі служби за віком, хворобою або вислугою років працівникам міліції, особам начальницького складу податкової міліції, рядового і начальницького складу кримінально-виконавчої системи, державної пожежної охорони, дітям (до досягнення повноліття) працівників міліції, осіб начальницького складу податкової міліції, рядового і начальницького складу кримінально-виконавчої системи, державної пожежної охорони, загиблих або померлих у зв'язку з виконанням службових обов'язків, непрацездатним членам сімей, які перебували на їх утриманні, на придбання твердого палива
90206;Інші пільги ветеранам військової служби, ветеранам органів внутрішніх справ, ветеранам податкової міліції, ветеранам державної пожежної охорони, ветеранам Державної кримінально-виконавчої служби, ветеранам служби цивільного захисту, ветеранам Державної служби спеціального зв'язку та захисту інформації України, вдовам (вдівцям) померлих (загиблих) ветеранів військової служби, ветеранів органів внутрішніх справ, ветеранів податкової міліції, ветеранів державної пожежної охорони, ветеранів Державної кримінально-виконавчої служби, ветеранів служби цивільного захисту та ветеранів Державної служби спеціального зв'язку та захисту інформації України, особам, звільненим з військової служби, які стали інвалідами під час проходження військової служби, пенсіонерам з числа слідчих прокуратури
90207;Пільги громадянам, які постраждали внаслідок Чорнобильської катастрофи, дружинам (чоловікам) та опікунам (на час опікунства) дітей померлих громадян, смерть яких пов'язана з Чорнобильською катастрофою, на житлово-комунальні послуги
90208;Пільги громадянам, які постраждали внаслідок Чорнобильської катастрофи, дружинам (чоловікам) та опікунам (на час опікунства) дітей померлих громадян, смерть яких пов'язана з Чорнобильською катастрофою, на придбання твердого палива
90209;Інші пільги громадянам, які постраждали внаслідок Чорнобильської катастрофи, дружинам (чоловікам) та опікунам (на час опікунства) дітей померлих громадян, смерть яких пов'язана з Чорнобильською катастрофою
90210;"Пільги пенсіонерам з числа спеціалістів із захисту рослин, передбачені частиною четвертою статті 20 Закону України ""Про захист рослин"", громадянам, передбачені пунктом ""ї"" частини першої статті 77 Основ законодавства про охорону здоров'я, частиною четвертою статті 29 Основ законодавства про культуру, частиною другою статті 30 Закону України ""Про бібліотеки та бібліотечну справу"", абзацом першим частини четвертої статті 57 Закону України ""Про освіту"", на безоплатне користування житлом, опаленням та освітленням"
90211;"Пільги пенсіонерам з числа спеціалістів із захисту рослин, передбачені частиною четвертою статті 20 Закону України ""Про захист рослин"", громадянам, передбачені пунктом ""ї"" частини першої статті 77 Основ законодавства про охорону здоров'я, частиною четвертою статті 29 Основ законодавства про культуру, частиною другою статті 30 Закону України ""Про бібліотеки та бібліотечну справу"", абзацом першим частини четвертої статті 57 Закону України ""Про освіту"", на придбання твердого та рідкого пічного побутового палива"
90212;Пільги на медичне обслуговування громадянам, які постраждали внаслідок Чорнобильської катастрофи
90213;Оздоровлення громадян, які постраждали внаслідок Чорнобильської катастрофи
90214;Пільги окремим категоріям громадян з послуг зв'язку
90215;Пільги багатодітним сім'ям на житлово-комунальні послуги
90216;Пільги багатодітним сім'ям на придбання твердого палива та скрапленого газу
90302;Допомога у зв'язку з вагітністю і пологами
90303;Допомога на догляд за дитиною віком до 3 років
90304;Допомога при народженні дитини
90305;Допомога на дітей, над якими встановлено опіку чи піклування
90306;Допомога на дітей одиноким матерям
90307;Тимчасова державна допомога дітям
90308;Допомога при усиновленні дитини
90401;Державна соціальна допомога малозабезпеченим сім'ям
90403;Виплата компенсації реабілітованим
90405;Субсидії населенню для відшкодування витрат на оплату житлово-комунальних послуг
90406;Субсидії населенню для відшкодування витрат на придбання твердого та рідкого пічного побутового палива і скрапленого газу
90411;Кошти на забезпечення побутовим вугіллям окремих категорій населення
90412;Інші видатки на соціальний захист населення
90413;Допомога на догляд за інвалідом I чи II групи внаслідок психічного розладу
90414;Компенсація особам, які згідно із статтями 43 та 48 Гірничого закону України мають право на безоплатне отримання вугілля на побутові потреби, але проживають у будинках, що мають центральне опалення
90416;Інші видатки на соціальний захист ветеранів війни та праці
90417;Витрати на поховання учасників бойових дій та інвалідів війни
90601;Будинки-інтернати для малолітніх інвалідів
90700;Утримання закладів, що надають соціальні послуги дітям, які опинились в складних життєвих обставинах
90802;Інші програми соціального захисту дітей
90901;Будинки-інтернати (пансіонати) для літніх людей та інвалідів системи соціального захисту
90902;Інші будинки-інтернати для літніх людей та інвалідів
91101;Утримання центрів соціальних служб для сім'ї, дітей та молоді
91102;Програми і заходи центрів соціальних служб для сім'ї, дітей та молоді
91103;Соціальні програми і заходи державних органів у справах молоді
91104;Соціальні програми і заходи державних органів з питань забезпечення рівних прав та можливостей жінок і чоловіків
91105;Утримання клубів підлітків за місцем проживання
91106;Інші видатки
91107;Соціальні програми і заходи державних органів у справах сім'ї
