Код;Коротка назва;Колір;Іконка;Детальний опис
250354;Субвенція місцевим бюджетам (будівництво);;;Субвенція з державного бюджету місцевим бюджетам на будівництво, реконструкцію, ремонт та утримання вулиць і доріг комунальної власності у населених пунктах
250355;Субвенція для  АРК (соціоекономічний розвиток);;;Субвенція з державного бюджету на соціально-економічний розвиток Автономної Республіки Крим
250356;;;;Субвенція з державного бюджету обласному бюджету Луганської області на капітальний ремонт управління соціального захисту населення
250357;Позицію виключено;;;Позицію виключено
250357;;;;"Субвенція з державного бюджету обласному бюджету Одеської області на проведення першочергових робіт з будівництва системи відводу стічних вод від станції біологічної очистки ""Північна"" у місті Одесі на об'єкті ""Глибоководний випуск"""
250358;Субвенція місцевим бюджетам (соціоекономічний розвиток);;;Субвенція з державного бюджету місцевим бюджетам на соціально-економічний розвиток
250359;Субвенція місцевим бюджетам (охорона здоров'я);;;Субвенція з державного бюджету місцевим бюджетам на придбання витратних матеріалів та медичного обладнання для закладів охорони здоров'я
250361;Позицію виключено;;;Позицію виключено
250361;Субвенція Київськії області (соціоекономічний розвиток);;;Субвенція з державного бюджету обласному бюджету Волинської області на соціально-економічний розвиток Волинської області
250362;;;;Субвенція з державного бюджету місцевим бюджетам на фінансування заходів соціально-економічної компенсації ризику населення, яке проживає на території зони спостереження
250366;Субвенція місцевим бюджетам (соціоекономічний розвиток);;;Субвенція з державного бюджету місцевим бюджетам на здійснення заходів щодо соціально-економічного розвитку окремих територій
250369;;;;Субвенція з державного бюджету на завершення будівництва та введення в експлуатацію амбулаторії смт Глеваха Васильківського району Київської області
250376;Субвенція для допомоги дітям-сиротам;;;"Субвенція з державного бюджету місцевим бюджетам на виплату державної соціальної допомоги на дітей-сиріт та дітей, позбавлених батьківського піклування, грошового забезпечення батькам-вихователям і прийомним батькам за надання соціальних послуг у дитячих будинках сімейного типу та прийомних сім'ях за принципом ""гроші ходять за дитиною"""
250380;Інші субвенції;;;Інші субвенції
250382;;;;Субвенція з державного бюджету місцевим бюджетам на фінансування Програм - переможців Всеукраїнського конкурсу проектів та програм розвитку місцевого самоврядування
250383;Субвенція для погашення заборгованості (тепло);;;Субвенція з державного бюджету місцевим бюджетам на погашення заборгованості з різниці в тарифах на теплову енергію, що вироблялася, транспортувалася та постачалася населенню, яка виникла в зв'язку з невідповідністю фактичної вартості теплової енергії тарифам, що затверджувалися або погоджувалися відповідними органами державної влади чи органами місцевого самоврядування
250384;Позицію виключено;;;Позицію виключено
250384;Субвенція м. Донецьк (охорона здоров'я);;;Субвенція з державного бюджету міському бюджету міста Донецька на придбання сучасного медичного обладнання для закладів охорони здоров'я
250388;Субвенція для виборів ВР АРК;;;Субвенція з державного бюджету місцевим бюджетам на проведення виборів депутатів Верховної Ради Автономної Республіки Крим, місцевих рад та сільських, селищних, міських голів
250389;Субвенція м.Київ (охорона здоров'я);;;Субвенція з державного бюджету міському бюджету міста Києва на забезпечення функціонування Центру ядерної медицини з використанням ПЕТ-технологій Київської міської онкологічної лікарні
250390;Субвенція м. Дзержинськ (охорона здоров'я);;;Субвенція з державного бюджету міському бюджету міста Дзержинськ Донецької області на придбання сучасного лікувально-діагностичного обладнання для закладів охорони здоров'я
250391;Субвенція Дніпропетровській області (охорона здоров'я);;;Субвенція з державного бюджету обласному бюджету Дніпропетровської області на придбання медичного обладнання та автомобілів швидкої медичної допомоги для закладів охорони здоров'я
250392;Субвенція Київській області (охорона здоров'я);;;Субвенція з державного бюджету обласному бюджету Київської області на придбання медичного обладнання для Київської обласної клінічної лікарні
250393;Субвенція Закарпатській області (охорона здоров'я);;;Субвенція з державного бюджету обласному бюджету Закарпатської області на придбання сучасного високовартісного лікувального та діагностичного обладнання для закладів охорони здоров'я
250395;Субвенція Баранівському району (соціоекономічний розвиток);;;Субвенція з державного бюджету бюджету Баранівського району Житомирської області на соціально-економічний розвиток
250396;Субвенція Червоноармійському району (соціоекономічний розвиток);;;Субвенція з державного бюджету бюджету Новоград-Волинського району Житомирської області на соціально-економічний розвиток
250397;Субвенція Червоноармійському району (соціоекономічний розвиток);;;Субвенція з державного бюджету бюджету Червоноармійського району Житомирської області на соціально-економічний розвиток
250398;Субвенція Ємільчинському району (соціоекономічний розвиток);;;Субвенція з державного бюджету бюджету Ємільчинського району Житомирської області на соціально-економічний розвиток
250398;Позицію виключено;;;Позицію виключено
250402;Видатки на покриття заборгованостей;;;Видатки на покриття заборгованостей, що виникли у попередні роки із заробітної плати працівників бюджетних установ, грошового забезпечення, стипендій та інших соціальних виплат
250403;Видатки на покриття заборгованостей;;;Видатки на покриття інших заборгованостей, що виникли у попередні роки
250404;Інші видатки;;;Інші видатки
250405;Будівництво та реконструкція релігійних споруд;;;Видатки на будівництво та реконструкцію релігійних споруд
250901;Впровадження проектів розвитку;;;Впровадження проектів розвитку за рахунок коштів, залучених державою
250902;Повернення позик;;;Повернення позик, наданих для впровадження проектів розвитку за рахунок коштів, залучених державою
250903;Надання бюджетних позичок СПД;;;Надання бюджетних позичок суб'єктам підприємницької діяльності
250904;Повернення бюджетних позичок;;;Повернення бюджетних позичок
250905;Часткова компенсація відсоткової ставки;;;Часткова компенсація відсоткової ставки кредитів комерційних банків молодим сім'ям та одиноким молодим громадянам на будівництво (реконструкцію) та придбання житла
250907;Погашення відсотків за кредит;;;Погашення відсотків за користування довгостроковими пільговими кредитами на будівництво (реконструкцію) та придбання житла для молодих сімей та інших соціально незахищених категорій громадян
250908;Пільговий кредит громадянам на житло;;;Надання пільгового довгострокового кредиту громадянам на будівництво (реконструкцію) та придбання житла
250909;Повернення коштів;;;Повернення коштів, наданих для кредитування громадян на будівництво (реконструкцію) та придбання житла
250910;Пільговий кредит житлово-будівельним кооперативам;;;Надання пільгового кредиту членам житлово-будівельних кооперативів
250911;Державний кредит сільским забудовникам;;;Надання державного пільгового кредиту індивідуальним сільським забудовникам
250912;Повернення коштів;;;Повернення коштів, наданих для кредитування індивідуальних сільських забудовників
250913;Витрати;;;Витрати, пов'язані з наданням та обслуговуванням пільгових довгострокових кредитів, наданих громадянам на будівництво (реконструкцію) та придбання житла
250914;Витрати;;;Витрати, пов'язані з наданням та обслуговуванням державних пільгових кредитів, наданих індивідуальним сільським забудовникам
250915;Ремонт приміщень згідно «Вдосконалення системи соціальної допомоги»;;;"Фінансування ремонту приміщень управлінь праці та соціального захисту виконавчих органів міських (міст республіканського в Автономній Республіці Крим і обласного значення), районних у містах Києві і Севастополі та районних у містах рад для здійснення заходів з виконання спільного із Світовим банком проекту ""Вдосконалення системи соціальної допомоги"""
