Код;Коротка назва;Колір;Іконка;Детальний опис
150121;Заходи з ропередження аварій;;;Заходи з упередження аварій та запобігання техногенних катастроф у житлово-комунальному господарстві та на інших аварійних об'єктах комунальної власності
150122;Інвестиційні проекти;;;Інвестиційні проекти
150201;Збереження;;;Збереження, розвиток, реконструкція та реставрація пам'яток історії та культури
150202;Розробка схем масового застосування;;;Розробка схем та проектних рішень масового застосування
150203;Операційні видатки - паспортизація;;;Операційні видатки - паспортизація, інвентаризація пам'яток архітектури, премії в галузі архітектури
160000;Сільське і лісове господарство;;;Сільське і лісове господарство, рибне господарство та мисливство
160101;Землеустрій;;;Землеустрій
160600;Лісове господарство і мисливство;;;Лісове господарство і мисливство
160903;Програми в галузі сільського господарства;;;Програми в галузі сільського господарства, лісового господарства, рибальства та мисливства
170000;Транспорт;;;Транспорт, дорожнє господарство, зв'язок, телекомунікації та інформатика
170101;Регулювання цін на послуги автотранспорту;;;Регулювання цін на послуги місцевого автотранспорту
170102;Компенсації на пільговий проїзд автомобільним транспортом;;;Компенсаційні виплати на пільговий проїзд автомобільним транспортом окремим категоріям громадян
170103;Інші заходи у сфері автомобільного транспорту;;;Інші заходи у сфері автомобільного транспорту
170202;Севастопольський морський порт;;;Севастопольський морський торговельний порт
170203;Компенсації на пільговий проїзд на водному транспорті;;;Компенсаційні виплати за пільговий проїзд окремих категорій громадян на водному транспорті
170302;Компенсації на пільговий проїзд на залізничному транспорті;;;Компенсаційні виплати за пільговий проїзд окремих категорій громадян на залізничному транспорті
170303;Регулювання цін на послуги метрополітену;;;Регулювання цін на послуги метрополітену
170601;Регулювання цін на міськиц електротранспорт;;;Регулювання цін на послуги міського електротранспорту
170602;Компенсації на пільговий проїзд;;;Компенсаційні виплати на пільговий проїзд електротранспортом окремим категоріям громадян
170603;Інші заходи сфери електротранспорту;;;Інші заходи у сфері електротранспорту
170703;Видатки на проведення робіт;;;Видатки на проведення робіт, пов'язаних із будівництвом, реконструкцією, ремонтом та утриманням автомобільних доріг
170800;Зв'язок;;;Зв'язок
170901;Національна програма інформатизації;;;Національна програма інформатизації
171000;Діяльність і послуги;;;Діяльність і послуги, не віднесені до інших категорій
180000;Інші послуги;;;Інші послуги, пов'язані з економічною діяльністю
180107;Фінансування енергозберігаючих заходів;;;Фінансування енергозберігаючих заходів
180109;Програма стабілізації та соціально-економічного розвитку;;;Програма стабілізації та соціально-економічного розвитку територій
180401;Платежі за кредитними угодами;;;Платежі за кредитними угодами, укладеними під гарантії Уряду
180404;Підтримка малого і середнього підприємництва;;;Підтримка малого і середнього підприємництва
180405;Погашення реструктуризованої заборгованості;;;Видатки на погашення реструктуризованої заборгованості перед комерційними банками та на поповнення їх капіталу
180409;Внески органів влади Автономної Республіки Крим;;;Внески органів влади Автономної Республіки Крим та органів місцевого самоврядування у статутні фонди суб'єктів підприємницької діяльності
180410;Інші заходи;;;Інші заходи, пов'язані з економічною діяльністю
200000;Охорона природи та ядерна безпека;;;Охорона навколишнього природного середовища та ядерна безпека
200100;Раціональне використання водних ресурсів;;;Охорона і раціональне використання водних ресурсів
200200;Раціональне використання земель;;;Охорона і раціональне використання земель
200300;Створення захисних насаджень;;;Створення захисних лісових насаджень та полезахисних лісових смуг
200400;Раціональне використання мінеральних ресурсів;;;Охорона і раціональне використання мінеральних ресурсів
200600;Збереження природно-заповідного фонду;;;Збереження природно-заповідного фонду
200700;Інші природоохоронні заходи;;;Інші природоохоронні заходи
210000;Запобігання та ліквідація надзвичайних ситуацій;;;Запобігання та ліквідація надзвичайних ситуацій та наслідків стихійного лиха
210105;Видатки для запобігання від надзвичайних ситуацій;;;Видатки на запобігання та ліквідацію надзвичайних ситуацій та наслідків стихійного лиха
210106;Заходи з захисту від надзвичайних ситуацій;;;Заходи у сфері захисту населення і територій від надзвичайних ситуацій техногенного та природного характеру
210107;Заходи з мобілізаційної підготовки на місцях;;;Заходи та роботи з мобілізаційної підготовки місцевого значення
210110;Заходи з рятування на водах;;;Заходи з організації рятування на водах
210120;Видатки на ліквідацію наслідків стихійного лиха;;;Видатки на ліквідацію наслідків стихійного лиха, що сталося 23 - 27 липня 2008 року
230000;Обслуговування боргу;;;Обслуговування боргу
230100;Обслуговування внутрішнього боргу;;;Обслуговування внутрішнього боргу
230200;Обслуговування зовнішнього боргу;;;Обслуговування зовнішнього боргу
240000;Цільові фонди;;;Цільові фонди
240601;Раціональне використання природних ресурсів;;;Охорона та раціональне використання природних ресурсів
240602;Утилізація відходів;;;Утилізація відходів
240603;Ліквідація іншого забруднення природи;;;Ліквідація іншого забруднення навколишнього природного середовища
240604;Інша діяльність у сфері охорони природи;;;Інша діяльність у сфері охорони навколишнього природного середовища
240605;Збереження природно-заповідного фонду;;;Збереження природно-заповідного фонду
240606;Заходи по заповненню водосховищ;;;Заходи по заповненню водосховищ
240800;Інші фонди;;;Інші фонди
240900;Цільові фонди;;;Цільові фонди, утворені Верховною Радою Автономної Республіки Крим, органами місцевого самоврядування і місцевими органами виконавчої влади
250000;Видатки;;;Видатки, не віднесені до основних груп
250102;Резервний фонд;;;Резервний фонд
250203;Проведення виборів депутатів ВР АРК;;;Проведення виборів народних депутатів Верховної Ради Автономної Республіки Крим, місцевих рад та сільських, селищних, міських голів
250205;Проведення референдумів;;;Проведення референдумів
250207;Утримання апарату Виборчої комісії АРК;;;Утримання апарату Виборчої комісії Автономної Республіки Крим
250301;Кошти;;;Кошти, що передаються до державного бюджету з бюджету Автономної Республіки Крим, обласних і районних бюджетів, міських (міст Києва та Севастополя, міст республіканського Автономної Республіки Крим та обласного значення) бюджетів, інших бюджетів місцевого самоврядування, для яких у державному бюджеті визначаються міжбюджетні трансферти
250302;Кошти;;;Кошти, що передаються до районних та міських (міст Києва і Севастополя, міст республіканського і обласного значення) бюджетів з міських (міст районного значення), селищних, сільських та районних у містах бюджетів
250303;Кошти;;;Кошти, що передаються за взаємними розрахунками із додаткової дотації до державного бюджету
250304;Кошти;;;Кошти, що передаються за взаємними розрахунками із додаткової дотації з районних та міських (міст Києва і Севастополя, міст республіканського та обласного значення) до міських (міст районного значення), селищних та сільських бюджетів
250305;Кошти;;;Кошти, що передаються за взаємними розрахунками із додаткової дотації з міських (міст районного значення), селищних та сільських бюджетів до районних та міських (міст Києва і Севастополя, міст республіканського та обласного значення) бюджетів
250307;Кошти;;;Кошти, що передаються за взаємними розрахунками до державного бюджету з місцевих бюджетів
250308;Кошти;;;Кошти, що передаються за взаємними розрахунками до місцевих бюджетів з державного бюджету
250309;Кошти;;;Кошти, що передаються за взаємними розрахунками між місцевими бюджетами
250310;;;;Додаткова дотація з державного бюджету місцевим бюджетам на компенсацію втрат доходів місцевих бюджетів внаслідок наданих державою податкових пільг зі сплати земельного податку суб'єктам космічної діяльності та суб'єктам літакобудування
250311;Дотації вирівнювання;;;Дотації вирівнювання, що передаються з районних та міських (міст Києва і Севастополя, міст республіканського і обласного значення) бюджетів
250313;;;;Додаткова дотація з державного бюджету на вирівнювання фінансової забезпеченості місцевих бюджетів
250314;Дотація на забезпечення пальним;;;Додаткова дотація з державного бюджету місцевим бюджетам на забезпечення пальним станцій (відділень) екстреної, швидкої та невідкладної медичної допомоги
250315;Інші додаткові дотації;;;Інші додаткові дотації
250316;Субвенція Донецькій області (ПЕТ-КТ центр);;;Субвенція з державного бюджету обласному бюджету Донецької області на будівництво ПЕТ-КТ центру, капітальний ремонт і реконструкцію лікарняних споруд та закупівлю високовартісного медичного обладнання для Донецького обласного клінічного територіального медичного об'єднання
250317;;;;Додаткова дотація з державного бюджету місцевим бюджетам на компенсацію втрат доходів внаслідок розміщення Чорноморського флоту Російської Федерації на території міст Севастополя, Феодосії та смт Гвардійське Сімферопольського району
250318;;;;Додаткова дотація з державного бюджету місцевим бюджетам на поліпшення умов оплати праці медичних працівників, які надають медичну допомогу хворим на заразну та активну форми туберкульозу
250320;;;;"Додаткова дотація з державного бюджету місцевим бюджетам на здійснення повноважень, встановлених Законом України ""Про затвердження Конституції Автономної Республіки Крим"""
250321;;;;Субвенція з державного бюджету місцевим бюджетам на відшкодування частини відсоткових ставок по залучених кредитах на оновлення парку автобусів та тролейбусів приймаючих міст по підготовці до проведення в Україні фінальної частини чемпіонату Європи 2012 року з футболу
250322;Позицію виключено;;;Позицію виключено
250323;Субвенція на утримання об'єктів спільного користування;;;Субвенція на утримання об'єктів спільного користування чи ліквідацію негативних наслідків діяльності об'єктів спільного користування
250324;Субвенція місцевим бюджетам (сім'ї з дітьми);;;Субвенція іншим бюджетам на виконання інвестиційних проектів
250326;Субвенція місцевим бюджетам (сім'ї з дітьми);;;Субвенція з державного бюджету місцевим бюджетам на виплату допомоги сім'ям з дітьми, малозабезпеченим сім'ям, інвалідам з дитинства, дітям-інвалідам та тимчасової державної допомоги дітям
250327;Позицію виключено;;;Позицію виключено
250328;Субвенція місцевим бюджетам (пільги на електроенергію);;;Субвенція з державного бюджету місцевим бюджетам на надання пільг та житлових субсидій населенню на оплату електроенергії, природного газу, послуг тепло-, водопостачання і водовідведення, квартирної плати (утримання будинків і споруд та прибудинкових територій), вивезення побутового сміття та рідких нечистот
250329;Субвенція місцевим бюджетам (надяння пільг);;;Субвенція з державного бюджету місцевим бюджетам на надання пільг з послуг зв'язку та інших передбачених законодавством пільг, в тому числі компенсації втрати частини доходів у зв'язку з відміною податку з власників транспортних засобів та відповідним збільшенням ставок акцизного податку з пального для фізичних осіб (крім пільг на одержання ліків, зубопротезування, оплату електроенергії, природного і скрапленого газу на побутові потреби, твердого та рідкого пічного побутового палива, послуг тепло-, водопостачання і водовідведення, квартирної плати (утримання будинків і споруд та прибудинкових територій), вивезення побутового сміття та рідких нечистот) та компенсацію за пільговий проїзд окремих категорій громадян
250330;Субвнція населенню (придбання палива);;;Субвенція з державного бюджету місцевим бюджетам на надання пільг та житлових субсидій населенню на придбання твердого та рідкого пічного побутового палива і скрапленого газу
250332;Позицію виключено;;;Позицію виключено
250335;Ремонт приміщень згідно «Вдосконалення системи соціальної допомоги»;;;"Субвенція з державного бюджету місцевим бюджетам на фінансування ремонту приміщень управлінь праці та соціального захисту виконавчих органів міських (міст республіканського в Автономній Республіці Крим і обласного значення) районних у містах Києві і Севастополі та районних у містах рад для здійснення заходів з виконання спільного із Світовим банком проекту ""Вдосконалення системи соціальної допомоги"""
250336;Позицію виключено;;;Позицію виключено
250338;Субвенція м. Севастополь (соціоекономічний розвиток);;;Субвенція державного бюджету місцевим бюджетам на розвиток соціально-економічної сфери міста Севастополя та інших населених пунктів, в яких дислокуються військові формування Чорноморського флоту Російської Федерації на території України
250339;Позицію виключено;;;Позицію виключено
250341;Позицію виключено;;;Позицію виключено
250342;;;;Субвенція з державного бюджету місцевим бюджетам на збереження середньої заробітної плати на період працевлаштування посадових осіб місцевого самоврядування з числа депутатів відповідних рад, що потребують працевлаштування в зв'язку із закінченням строку повноважень
250344;;;;Субвенція з місцевого бюджету державному бюджету на виконання програм соціально-економічного та культурного розвитку регіонів
250346;;;;"Субвенція з державного бюджету міському бюджету міста Києва для проведення консервації та сучасної музеєфікації, завершення археологічних досліджень Старокиївської гори із залишками фундаменту Десятинної церкви території пам'ятки археології національного значення ""Дитинець стародавнього Києва VIII - X ст. з фундаментом Десятинної церкви X ст."""
250349;Позицію виключено;;;Позицію виключено
250351;Позицію виключено;;;Позицію виключено
250351;Субвенція місцевим бюджетам (розвиток регіонів);;;Субвенції з державного бюджету місцевим бюджетам на реалізацію пріоритетів розвитку регіонів
250352;Субвенція на проведення видатків місцевих бюджетів;;;Субвенція на проведення видатків місцевих бюджетів, що враховуються при визначенні обсягу міжбюджетних трансфертів
250353;Субвенція на проведення видатків місцевих бюджетів;;;Субвенція на проведення видатків місцевих бюджетів, що не враховуються при визначенні обсягу міжбюджетних трансфертів
