Код;Детальний опис
91108;Заходи з оздоровлення та відпочинку дітей, крім заходів з оздоровлення дітей, що здійснюються за рахунок коштів на оздоровлення громадян, які постраждали внаслідок Чорнобильської катастрофи
91201;Розселення та облаштування депортованих кримських татар та осіб інших національностей, депортованих з України
91203;Навчання та трудове влаштування інвалідів
91204;Територіальні центри соціального обслуговування (надання соціальних послуг)
91205;Виплати грошової компенсації фізичним особам, які надають соціальні послуги громадянам похилого віку, інвалідам, дітям-інвалідам, хворим, які не здатні до самообслуговування і потребують сторонньої допомоги
91206;"Центри соціальної реабілітації дітей - інвалідів; центри професійної реабілітації інвалідів"
91207;Пільги, що надаються населенню (крім ветеранів війни і праці, військової служби, органів внутрішніх справ та громадян, які постраждали внаслідок Чорнобильської катастрофи), на оплату житлово-комунальних послуг і природного газу
91209;Фінансова підтримка громадських організацій інвалідів і ветеранів
91210;Служби технічного нагляду за будівництвом та капітальним ремонтом
91211;Централізовані бухгалтерії
91212;Обробка інформації з нарахування та виплати допомог і компенсацій
91214;Інші установи та заклади
91300;Державна соціальна допомога інвалідам з дитинства та дітям-інвалідам
91303;Компенсаційні виплати інвалідам на бензин, ремонт, техобслуговування автотранспорту та транспортне обслуговування
91304;Встановлення телефонів інвалідам I та II груп
100000;Житлово-комунальне господарство
100101;Житлово-експлуатаційне господарство
100102;Капітальний ремонт житлового фонду місцевих органів влади
100103;Дотація житлово-комунальному господарству
100105;Видатки на утримання об'єктів соціальної сфери підприємств, що передаються до комунальної власності
100106;Капітальний ремонт житлового фонду об'єднань співвласників багатоквартирних будинків
100201;Теплові мережі
100202;Водопровідно-каналізаційне господарство
100203;Благоустрій міст, сіл, селищ
100205;Газові заводи і газова мережа
100206;Готельне господарство
100207;Берегоукріплювальні роботи
100208;Видатки на впровадження засобів обліку витрат та регулювання споживання води та теплової енергії
100209;Заходи, пов'язані з поліпшенням питної води
100301;Збір та вивезення сміття і відходів, експлуатація каналізаційних систем
100302;Комбінати комунальних підприємств, районні виробничі об'єднання та інші підприємства, установи та організації житлово-комунального господарства
100303;Ремонтно-будівельні організації житлово-комунального господарства
100400;Підприємства і організації побутового обслуговування, що входять до комунальної власності
100501;Позицію виключено
100601;Відшкодування різниці між розміром ціни (тарифу) на житлово-комунальні послуги, що затверджувалися або погоджувалися рішенням місцевого органу виконавчої влади та органу місцевого самоврядування, та розміром економічно обгрунтованих витрат на їх виробництво(надання)
100602;Погашення заборгованості з різниці в тарифах на теплову енергію, що вироблялася, транспортувалася та постачалася населенню, яка виникла в зв'язку з невідповідністю фактичної вартості теплової енергії тарифам, що затверджувалися або погоджувалися відповідними органами державної влади чи органами місцевого самоврядування
110000;Культура і мистецтво
110101;Творчі спілки
110102;Театри
110103;Філармонії, музичні колективи і ансамблі та інші мистецькі заклади та заходи
110104;Видатки на заходи, передбачені державними і місцевими програмами розвитку культури і мистецтва
110105;Фінансова підтримка гастрольної діяльності
110201;Бібліотеки
110202;Музеї і виставки
110203;Заповідники
110204;Палаци і будинки культури, клуби та інші заклади клубного типу
110205;Школи естетичного виховання дітей
110206;Позицію виключено
110300;Кінематографія
110502;Інші культурно-освітні заклади та заходи
120000;Засоби масової інформації
120100;Телебачення і радіомовлення
120201;Періодичні видання (газети та журнали)
120300;Книговидання
120400;Інші засоби масової інформації
130000;Фізична культура і спорт
130102;Проведення навчально-тренувальних зборів і змагань
130104;Видатки на утримання центрів з інвалідного спорту і реабілітаційних шкіл
130105;Проведення навчально-тренувальних зборів і змагань та заходів з інвалідного спорту
130106;Проведення навчально-тренувальних зборів і змагань з неолімпійських видів спорту
130107;Утримання та навчально-тренувальна робота дитячо-юнацьких спортивних шкіл
130110;Фінансова підтримка спортивних споруд
130112;Інші видатки
130113;Централізовані бухгалтерії
130114;Забезпечення підготовки спортсменів вищих категорій школами вищої спортивної майстерності
130115;"Центри ""Спорт для всіх"" та заходи з фізичної культури"
130201;Проведення навчально-тренувальних зборів і змагань (які проводяться громадськими організаціями фізкультурно-спортивної спрямованості)
130202;Проведення заходів з нетрадиційних видів спорту і масових заходів з фізичної культури (які проводяться громадськими організаціями фізкультурно-спортивної спрямованості)
130203;Утримання та навчально-тренувальна робота дитячо-юнацьких спортивних шкіл (які підпорядковані громадським організаціям фізкультурно-спортивної спрямованості)
130204;"Утримання апарату управління громадських фізкультурно-спортивних організацій (ФСТ ""Колос"")"
130205;Фінансова підтримка спортивних споруд, які належать громадським організаціям фізкультурно-спортивної спрямованості
150000;Будівництво
150101;Капітальні вкладення
150104;Виплата компенсації на здешевлення вартості будівництва житла молодіжним житловим комплексам
150107;Житлове будівництво і придбання житла військовослужбовцям та особам рядового і начальницького складу, звільненим у запас або відставку за станом здоров'я, віком, вислугою років та у зв'язку із скороченням штатів, які перебувають на квартирному обліку за місцем проживання, членам сімей з числа цих осіб, які загинули під час виконання ними службових обов'язків, а також учасникам бойових дій в Афганістані та воєнних конфліктів
150109;Компенсація селянським (фермерським) господарствам вартості будівництва об'єктів виробничого і невиробничого призначення
150110;Проведення невідкладних відновлювальних робіт, будівництво та реконструкція загальноосвітніх навчальних закладів
150111;Проведення невідкладних відновлювальних робіт, будівництво та реконструкція спеціалізованих навчальних закладів
150112;Проведення невідкладних відновлювальних робіт, будівництво та реконструкція позашкільних навчальних закладів
150114;Проведення невідкладних відновлювальних робіт, будівництво та реконструкція лікарень загального профілю
150115;Завершення проектів газифікації сільських населених пунктів з високим ступенем готовності
150118;Житлове будівництво та придбання житла для окремих категорій населення
150119;Проведення невідкладних відновлювальних робіт, будівництво та реконструкція спеціалізованих лікарень та інших спеціалізованих закладів
150120;Будівництво та розвиток мережі метрополітенів
150121;Заходи з упередження аварій та запобігання техногенних катастроф у житлово-комунальному господарстві та на інших аварійних об'єктах комунальної власності
150122;Інвестиційні проекти
150201;Збереження, розвиток, реконструкція та реставрація пам'яток історії та культури
150202;Розробка схем та проектних рішень масового застосування
150203;Операційні видатки - паспортизація, інвентаризація пам'яток архітектури, премії в галузі архітектури
160000;Сільське і лісове господарство, рибне господарство та мисливство
160101;Землеустрій
160600;Лісове господарство і мисливство
160903;Програми в галузі сільського господарства, лісового господарства, рибальства та мисливства
170000;Транспорт, дорожнє господарство, зв'язок, телекомунікації та інформатика
170101;Регулювання цін на послуги місцевого автотранспорту
170102;Компенсаційні виплати на пільговий проїзд автомобільним транспортом окремим категоріям громадян
170103;Інші заходи у сфері автомобільного транспорту
170202;Севастопольський морський торговельний порт
170203;Компенсаційні виплати за пільговий проїзд окремих категорій громадян на водному транспорті
170302;Компенсаційні виплати за пільговий проїзд окремих категорій громадян на залізничному транспорті
170303;Регулювання цін на послуги метрополітену
170601;Регулювання цін на послуги міського електротранспорту
170602;Компенсаційні виплати на пільговий проїзд електротранспортом окремим категоріям громадян
170603;Інші заходи у сфері електротранспорту
170703;Видатки на проведення робіт, пов'язаних із будівництвом, реконструкцією, ремонтом та утриманням автомобільних доріг
170800;Зв'язок
170901;Національна програма інформатизації
171000;Діяльність і послуги, не віднесені до інших категорій
180000;Інші послуги, пов'язані з економічною діяльністю
180107;Фінансування енергозберігаючих заходів
180109;Програма стабілізації та соціально-економічного розвитку територій
180401;Платежі за кредитними угодами, укладеними під гарантії Уряду
180404;Підтримка малого і середнього підприємництва
180405;Видатки на погашення реструктуризованої заборгованості перед комерційними банками та на поповнення їх капіталу
180409;Внески органів влади Автономної Республіки Крим та органів місцевого самоврядування у статутні фонди суб'єктів підприємницької діяльності
180410;Інші заходи, пов'язані з економічною діяльністю
200000;Охорона навколишнього природного середовища та ядерна безпека
200100;Охорона і раціональне використання водних ресурсів
200200;Охорона і раціональне використання земель
200300;Створення захисних лісових насаджень та полезахисних лісових смуг
200400;Охорона і раціональне використання мінеральних ресурсів
200600;Збереження природно-заповідного фонду
200700;Інші природоохоронні заходи
210000;Запобігання та ліквідація надзвичайних ситуацій та наслідків стихійного лиха
210105;Видатки на запобігання та ліквідацію надзвичайних ситуацій та наслідків стихійного лиха
210106;Заходи у сфері захисту населення і територій від надзвичайних ситуацій техногенного та природного характеру
210107;Заходи та роботи з мобілізаційної підготовки місцевого значення
210110;Заходи з організації рятування на водах
210120;Видатки на ліквідацію наслідків стихійного лиха, що сталося 23 - 27 липня 2008 року
230000;Обслуговування боргу
230100;Обслуговування внутрішнього боргу
230200;Обслуговування зовнішнього боргу
240000;Цільові фонди
240601;Охорона та раціональне використання природних ресурсів
240602;Утилізація відходів
240603;Ліквідація іншого забруднення навколишнього природного середовища
240604;Інша діяльність у сфері охорони навколишнього природного середовища
240605;Збереження природно-заповідного фонду
240606;Заходи по заповненню водосховищ
240800;Інші фонди
240900;Цільові фонди, утворені Верховною Радою Автономної Республіки Крим, органами місцевого самоврядування і місцевими органами виконавчої влади
250000;Видатки, не віднесені до основних груп
250102;Резервний фонд
250203;Проведення виборів народних депутатів Верховної Ради Автономної Республіки Крим, місцевих рад та сільських, селищних, міських голів
250205;Проведення референдумів
250207;Утримання апарату Виборчої комісії Автономної Республіки Крим
250301;Кошти, що передаються до державного бюджету з бюджету Автономної Республіки Крим, обласних і районних бюджетів, міських (міст Києва та Севастополя, міст республіканського Автономної Республіки Крим та обласного значення) бюджетів, інших бюджетів місцевого самоврядування, для яких у державному бюджеті визначаються міжбюджетні трансферти
250302;Кошти, що передаються до районних та міських (міст Києва і Севастополя, міст республіканського і обласного значення) бюджетів з міських (міст районного значення), селищних, сільських та районних у містах бюджетів
250303;Кошти, що передаються за взаємними розрахунками із додаткової дотації до державного бюджету
250304;Кошти, що передаються за взаємними розрахунками із додаткової дотації з районних та міських (міст Києва і Севастополя, міст республіканського та обласного значення) до міських (міст районного значення), селищних та сільських бюджетів
250305;Кошти, що передаються за взаємними розрахунками із додаткової дотації з міських (міст районного значення), селищних та сільських бюджетів до районних та міських (міст Києва і Севастополя, міст республіканського та обласного значення) бюджетів
250307;Кошти, що передаються за взаємними розрахунками до державного бюджету з місцевих бюджетів
250308;Кошти, що передаються за взаємними розрахунками до місцевих бюджетів з державного бюджету
250309;Кошти, що передаються за взаємними розрахунками між місцевими бюджетами
250310;Додаткова дотація з державного бюджету місцевим бюджетам на компенсацію втрат доходів місцевих бюджетів внаслідок наданих державою податкових пільг зі сплати земельного податку суб'єктам космічної діяльності та суб'єктам літакобудування
250311;Дотації вирівнювання, що передаються з районних та міських (міст Києва і Севастополя, міст республіканського і обласного значення) бюджетів
250313;Додаткова дотація з державного бюджету на вирівнювання фінансової забезпеченості місцевих бюджетів
250314;Додаткова дотація з державного бюджету місцевим бюджетам на забезпечення пальним станцій (відділень) екстреної, швидкої та невідкладної медичної допомоги
250315;Інші додаткові дотації
250316;Субвенція з державного бюджету обласному бюджету Донецької області на будівництво ПЕТ-КТ центру, капітальний ремонт і реконструкцію лікарняних споруд та закупівлю високовартісного медичного обладнання для Донецького обласного клінічного територіального медичного об'єднання
250317;Додаткова дотація з державного бюджету місцевим бюджетам на компенсацію втрат доходів внаслідок розміщення Чорноморського флоту Російської Федерації на території міст Севастополя, Феодосії та смт Гвардійське Сімферопольського району
250318;Додаткова дотація з державного бюджету місцевим бюджетам на поліпшення умов оплати праці медичних працівників, які надають медичну допомогу хворим на заразну та активну форми туберкульозу
250320;"Додаткова дотація з державного бюджету місцевим бюджетам на здійснення повноважень, встановлених Законом України ""Про затвердження Конституції Автономної Республіки Крим"""
250321;Субвенція з державного бюджету місцевим бюджетам на відшкодування частини відсоткових ставок по залучених кредитах на оновлення парку автобусів та тролейбусів приймаючих міст по підготовці до проведення в Україні фінальної частини чемпіонату Європи 2012 року з футболу
